{
  "id": 150,
  "slug": "mallards-pike-sculpture-trail",
  "name": "Mallards Pike & Sculpture Trail",
  "region": "English Borders (Forest of Dean & Herefordshire)",
  "sub_area": "Forest of Dean",
  "nearest_town": "Blakeney",
  "distance_mi": 4.0,
  "elevation_gain_m": 110,
  "est_time_hrs": 1.75,
  "difficulty": "Easy",
  "route_type": "Loop",
  "terrain": "Gravel forest tracks, sculpture trail",
  "dogs_allowed": "Yes",
  "dog_lead_policy": "Off-lead OK",
  "pushchair_friendly": "Yes",
  "waymarked": "Yes (Sculpture Trail)",
  "best_season": "All year",
  "highlights": "Mallards Pike lake joined to the famous open-air Dean Sculpture Trail.",
  "points_of_interest": "Dean Sculpture Trail (18 works since 1986); Go Ape; pine martens",
  "viewpoints": "Mallards Pike lake; forest canopy",
  "water_features": "Mallards Pike lake",
  "picnic_spots": "Lakeside picnic tables",
  "parking_start": "Mallards Pike car park (pay & display)",
  "food_drink_nearby": "Beechenhurst Lodge café; Rising Sun Moseley Green",
  "toilets": "Mallards Pike café (seasonal)",
  "public_transport": "None",
  "hazards_notes": "Sculpture locations change; Go Ape busy weekends",
  "start_postcode": "GL15 4HD",
  "drive_from_monmouth_mins": 30
}
