{
  "id": 137,
  "slug": "cwmystwyth-mines-mountain-road",
  "name": "Cwmystwyth Mines & Mountain Road",
  "region": "Mid Wales (Powys & Ceredigion)",
  "sub_area": "Cambrian Mountains",
  "nearest_town": "Cwmystwyth",
  "distance_mi": 4.0,
  "elevation_gain_m": 200,
  "est_time_hrs": 2.0,
  "difficulty": "Easy/Moderate",
  "route_type": "Out-and-back",
  "terrain": "Quiet mountain road, mine tracks",
  "dogs_allowed": "Yes",
  "dog_lead_policy": "Off-lead OK",
  "pushchair_friendly": "No",
  "waymarked": "No",
  "best_season": "April–October",
  "highlights": "Ghostly spoil-heaps and ruined engine houses of Wales' largest metal mine, high in the Cambrians.",
  "points_of_interest": "Cwmystwyth Lead Mines (Bronze Age to 20th c.); Copper Arch; Kite Country feeding station nearby",
  "viewpoints": "Upland road panoramas toward Plynlimon",
  "water_features": "Afon Ystwyth gorge",
  "picnic_spots": "On grass above Afon Ystwyth",
  "parking_start": "Lay-by on Cwmystwyth mountain road (B4574)",
  "food_drink_nearby": "The Hafod Hotel; Y Llew Du Aberystwyth (further)",
  "toilets": "None",
  "public_transport": "None",
  "hazards_notes": "Mine shafts unfenced — keep children & dogs close; no phone signal",
  "start_postcode": "SY23 4AE",
  "drive_from_monmouth_mins": 120
}
