{
  "id": 15,
  "slug": "llangorse-lake-circular",
  "name": "Llangorse Lake Circular",
  "region": "Brecon Beacons / Bannau Brycheiniog",
  "sub_area": "Llangorse Lake",
  "nearest_town": "Llangorse",
  "distance_mi": 6.5,
  "elevation_gain_m": 100,
  "est_time_hrs": 3.0,
  "difficulty": "Easy",
  "route_type": "Loop",
  "terrain": "Field paths, lanes, lakeside track",
  "dogs_allowed": "Yes",
  "dog_lead_policy": "On lead (livestock, ground-nesting birds)",
  "pushchair_friendly": "Partial",
  "waymarked": "Partial",
  "best_season": "Spring–Autumn",
  "highlights": "Largest natural lake in South Wales; birdwatching and crannog.",
  "points_of_interest": "Bronze Age crannog (artificial island); St Paulinus church, Llangasty",
  "viewpoints": "Views to Central Beacons across the lake",
  "water_features": "Llangorse Lake (Llyn Syfaddan)",
  "picnic_spots": "Llangasty churchyard; lake shore picnic area",
  "parking_start": "Llangasty or Llangorse village parking",
  "food_drink_nearby": "Castle Inn Llangorse; Red Lion Llangorse",
  "toilets": "Llangorse (in season)",
  "public_transport": "Very limited",
  "hazards_notes": "Some road walking; reed beds restrict lake access",
  "start_postcode": "LD3 7TR",
  "drive_from_monmouth_mins": 50
}
