{
  "id": 152,
  "slug": "puzzlewood-braceland",
  "name": "Puzzlewood & Braceland",
  "region": "English Borders (Forest of Dean & Herefordshire)",
  "sub_area": "Forest of Dean",
  "nearest_town": "Coleford",
  "distance_mi": 2.0,
  "elevation_gain_m": 60,
  "est_time_hrs": 1.25,
  "difficulty": "Easy",
  "route_type": "Loop",
  "terrain": "Narrow rock-cut paths, wooden bridges",
  "dogs_allowed": "Yes (on lead)",
  "dog_lead_policy": "On lead (site rules)",
  "pushchair_friendly": "No",
  "waymarked": "Partial (site marked)",
  "best_season": "All year",
  "highlights": "Moss-cloaked Roman iron-workings that inspired Tolkien — used as a Star Wars and Doctor Who set.",
  "points_of_interest": "Ancient 'scowles' (Roman iron mines); Star Wars filming location",
  "viewpoints": "Elf-stone viewpoints across mossy ravines",
  "water_features": "Small woodland stream",
  "picnic_spots": "Visitor-centre picnic garden",
  "parking_start": "Puzzlewood car park (entry fee)",
  "food_drink_nearby": "Puzzlewood tea room; The Angel Hotel Coleford",
  "toilets": "Puzzlewood visitor centre",
  "public_transport": "None",
  "hazards_notes": "Entry fee; not suitable for buggies; narrow rock paths",
  "start_postcode": "GL16 8QB",
  "drive_from_monmouth_mins": 25
}
