{
  "id": 90,
  "slug": "raglan-castle-lanes",
  "name": "Raglan Castle & Lanes",
  "region": "Wye Valley & Monmouthshire",
  "sub_area": "Monmouthshire",
  "nearest_town": "Raglan",
  "distance_mi": 3.5,
  "elevation_gain_m": 80,
  "est_time_hrs": 1.75,
  "difficulty": "Easy",
  "route_type": "Loop",
  "terrain": "Lanes, field paths",
  "dogs_allowed": "Yes",
  "dog_lead_policy": "On lead (roads, livestock)",
  "pushchair_friendly": "Partial",
  "waymarked": "Partial",
  "best_season": "All year",
  "highlights": "Short ramble from one of finest late-medieval castles in Britain.",
  "points_of_interest": "Raglan Castle (Cadw); 15th century ruins",
  "viewpoints": "Castle views across fields",
  "water_features": "None",
  "picnic_spots": "Castle grounds",
  "parking_start": "Raglan Castle car park",
  "food_drink_nearby": "The Beaufort Raglan; Clytha Arms",
  "toilets": "At castle",
  "public_transport": "Bus on A40",
  "hazards_notes": "Some road walking",
  "start_postcode": "NP15 2BT",
  "drive_from_monmouth_mins": 15
}
