{
  "id": 31,
  "slug": "oxwich-bay-point",
  "name": "Oxwich Bay & Point",
  "region": "Gower & Swansea Bay",
  "sub_area": "Oxwich",
  "nearest_town": "Oxwich",
  "distance_mi": 4.0,
  "elevation_gain_m": 100,
  "est_time_hrs": 2.0,
  "difficulty": "Easy",
  "route_type": "Loop",
  "terrain": "Beach, woodland, coast path",
  "dogs_allowed": "Yes",
  "dog_lead_policy": "On lead in nature reserve; beach restrictions May–Sep",
  "pushchair_friendly": "Partial",
  "waymarked": "Partial",
  "best_season": "All year",
  "highlights": "Long sandy beach, woodland and the ruins of Oxwich Castle.",
  "points_of_interest": "Oxwich Castle (Cadw); St Illtyd's church in woods",
  "viewpoints": "Oxwich Bay panorama; Pwll Du Head",
  "water_features": "Oxwich Bay; salt marsh",
  "picnic_spots": "Beach; woodland glade by church",
  "parking_start": "Oxwich beach car park (pay)",
  "food_drink_nearby": "Oxwich Bay Hotel; Beach House Restaurant (upscale)",
  "toilets": "Oxwich beach",
  "public_transport": "Seasonal Gower Explorer",
  "hazards_notes": "Seasonal dog ban on main beach (May–Sep)",
  "start_postcode": "SA3 1LS",
  "drive_from_monmouth_mins": 95
}
