{
  "id": 54,
  "slug": "marloes-peninsula",
  "name": "Marloes Peninsula",
  "region": "Pembrokeshire (South)",
  "sub_area": "Marloes (west Pembs border)",
  "nearest_town": "Marloes",
  "distance_mi": 7.0,
  "elevation_gain_m": 240,
  "est_time_hrs": 3.5,
  "difficulty": "Moderate",
  "route_type": "Loop",
  "terrain": "Clifftop coast path, beach",
  "dogs_allowed": "Yes",
  "dog_lead_policy": "On lead (livestock, birds, cliffs)",
  "pushchair_friendly": "No",
  "waymarked": "Yes (Wales Coast Path)",
  "best_season": "All year",
  "highlights": "Wild peninsula with one of Wales' best beaches (Marloes Sands).",
  "points_of_interest": "Iron Age fort at Deer Park; Runwayskiln WWII airfield",
  "viewpoints": "Skomer, Skokholm, Gateholm tidal island",
  "water_features": "Sea; coves",
  "picnic_spots": "Marloes Sands grassy top; Martin's Haven",
  "parking_start": "Marloes village car park; Martin's Haven NT",
  "food_drink_nearby": "Lobster Pot Marloes; The Griffin Dale",
  "toilets": "Marloes village",
  "public_transport": "None regular",
  "hazards_notes": "Paths close to cliff edges; seals at Martin's Haven",
  "start_postcode": "SA62 3BE",
  "drive_from_monmouth_mins": 160
}
