{
  "id": 118,
  "slug": "cwmyoy-leaning-church-vale-of-ewyas",
  "name": "Cwmyoy Leaning Church & Vale of Ewyas",
  "region": "Wye Valley & Monmouthshire",
  "sub_area": "Vale of Ewyas",
  "nearest_town": "Abergavenny",
  "distance_mi": 5.5,
  "elevation_gain_m": 380,
  "est_time_hrs": 3.25,
  "difficulty": "Moderate",
  "route_type": "Loop",
  "terrain": "Lanes, steep field paths, Hatterall Ridge (short section)",
  "dogs_allowed": "Yes",
  "dog_lead_policy": "On lead (livestock)",
  "pushchair_friendly": "No",
  "waymarked": "Partial",
  "best_season": "Apr–Oct",
  "highlights": "Most famously crooked church in Britain — climb the ridge above.",
  "points_of_interest": "St Martin's Church Cwmyoy (leans spectacularly due to landslip); ancient yew",
  "viewpoints": "Vale of Ewyas; Skirrid to the south",
  "water_features": "Afon Honddu",
  "picnic_spots": "Churchyard; ridge near Offa's Dyke",
  "parking_start": "Cwmyoy village (very limited)",
  "food_drink_nearby": "Skirrid Inn Llanvihangel Crucorney (oldest pub in Wales); The Hardwick Abergavenny",
  "toilets": "None",
  "public_transport": "None",
  "hazards_notes": "Very narrow single-track lanes to Cwmyoy; parking tight",
  "start_postcode": "NP7 7NT",
  "drive_from_monmouth_mins": 40
}
