{
  "id": 23,
  "slug": "usk-reservoir-circular",
  "name": "Usk Reservoir Circular",
  "region": "Brecon Beacons / Bannau Brycheiniog",
  "sub_area": "Fforest Fawr (west)",
  "nearest_town": "Trecastle",
  "distance_mi": 6.5,
  "elevation_gain_m": 140,
  "est_time_hrs": 3.0,
  "difficulty": "Easy/Moderate",
  "route_type": "Loop",
  "terrain": "Forestry roads and tracks",
  "dogs_allowed": "Yes",
  "dog_lead_policy": "On lead (forestry traffic)",
  "pushchair_friendly": "Partial",
  "waymarked": "Partial",
  "best_season": "All year",
  "highlights": "Big loop round a tranquil reservoir with dark-sky views.",
  "points_of_interest": "International Dark Sky Reserve",
  "viewpoints": "Mynydd Myddfai; Carmarthen Fans on clear days",
  "water_features": "Usk Reservoir",
  "picnic_spots": "Dam end picnic tables",
  "parking_start": "Usk Reservoir car park (signed from Trecastle)",
  "food_drink_nearby": "Castle Coaching Inn Trecastle",
  "toilets": "None",
  "public_transport": "None",
  "hazards_notes": "Long drive-in; remote",
  "start_postcode": "SA20 0YW",
  "drive_from_monmouth_mins": 80
}
