{
  "id": 1,
  "slug": "pen-y-fan-circular-motorway-route",
  "name": "Pen y Fan Circular (Motorway Route)",
  "region": "Brecon Beacons / Bannau Brycheiniog",
  "sub_area": "Central Beacons",
  "nearest_town": "Libanus",
  "distance_mi": 4.5,
  "elevation_gain_m": 460,
  "est_time_hrs": 2.5,
  "difficulty": "Moderate",
  "route_type": "Loop",
  "terrain": "Stone pitched path, grass ridge, steep climb",
  "dogs_allowed": "Yes",
  "dog_lead_policy": "On lead (sheep, cliff edges)",
  "pushchair_friendly": "No",
  "waymarked": "Partial",
  "best_season": "All year (winter needs kit)",
  "highlights": "Highest peak in South Wales (886m); iconic twin summit of Pen y Fan & Corn Du.",
  "points_of_interest": "Tommy Jones obelisk, Bronze Age cairns on summit",
  "viewpoints": "Summit panorama: Black Mountains, Bristol Channel, Carmarthen Fans on clear days",
  "water_features": "Taf Fechan streams at start",
  "picnic_spots": "Corn Du saddle (Bwlch Duwynt); grassy flat below Corn Du",
  "parking_start": "Pont ar Daf pay & display car park (off A470)",
  "food_drink_nearby": "Storey Arms nearby (no food); The Tai'r Bull Inn, Libanus; Felin Fach Griffin further afield",
  "toilets": "None on route (nearest: Storey Arms)",
  "public_transport": "T4 bus Cardiff–Brecon stops at Storey Arms",
  "hazards_notes": "Exposed to weather; path heavily eroded; busy at weekends",
  "start_postcode": "LD3 8NL",
  "drive_from_monmouth_mins": 55
}
