{
  "id": 42,
  "slug": "weobley-castle-landimore",
  "name": "Weobley Castle & Landimore",
  "region": "Gower & Swansea Bay",
  "sub_area": "North Gower",
  "nearest_town": "Llanrhidian",
  "distance_mi": 3.5,
  "elevation_gain_m": 80,
  "est_time_hrs": 1.75,
  "difficulty": "Easy",
  "route_type": "Loop",
  "terrain": "Field paths, saltmarsh fringe",
  "dogs_allowed": "Yes",
  "dog_lead_policy": "On lead (sheep — famous Gower salt marsh lamb)",
  "pushchair_friendly": "No",
  "waymarked": "Partial",
  "best_season": "All year",
  "highlights": "Clifftop castle ruin looking over vast saltmarsh.",
  "points_of_interest": "Weobley Castle (Cadw); wreck of the Paul at low tide",
  "viewpoints": "Loughor Estuary; Llanrhidian marsh ponies",
  "water_features": "Saltmarsh",
  "picnic_spots": "Near castle",
  "parking_start": "Weobley Castle farm car park",
  "food_drink_nearby": "Welcome to Town Llanrhidian; Greyhound Inn Oldwalls",
  "toilets": "Castle (seasonal)",
  "public_transport": "None",
  "hazards_notes": "Saltmarsh unsafe to walk on — stay on path",
  "start_postcode": "SA3 1HB",
  "drive_from_monmouth_mins": 95
}
