{
  "id": 127,
  "slug": "devil-s-bridge-mynach-falls",
  "name": "Devil's Bridge & Mynach Falls",
  "region": "Mid Wales (Powys & Ceredigion)",
  "sub_area": "Ceredigion",
  "nearest_town": "Devil's Bridge",
  "distance_mi": 1.5,
  "elevation_gain_m": 130,
  "est_time_hrs": 1.25,
  "difficulty": "Easy/Moderate",
  "route_type": "Loop",
  "terrain": "Steps, viewing platforms, riverside path",
  "dogs_allowed": "Partial",
  "dog_lead_policy": "On lead (steps, cliff edges)",
  "pushchair_friendly": "No",
  "waymarked": "Partial",
  "best_season": "All year",
  "highlights": "Triple-stacked bridge (1075 / 1753 / 1901) above a dramatic 90m tumble of waterfalls.",
  "points_of_interest": "Three stacked bridges; Robber's Cave; Jacob's Ladder (100 steps)",
  "viewpoints": "Punchbowl viewpoint; Mynach Falls overlook",
  "water_features": "Afon Mynach waterfalls; confluence with Rheidol",
  "picnic_spots": "By the Hafod Hotel lawn",
  "parking_start": "Devil's Bridge pay turnstile + car park opposite",
  "food_drink_nearby": "Hafod Hotel; Halfway Inn Pisgah",
  "toilets": "Devil's Bridge car park",
  "public_transport": "Vale of Rheidol narrow-gauge railway (seasonal)",
  "hazards_notes": "Turnstile fee applies; steps slippery when wet; dogs not allowed on all sections",
  "start_postcode": "SY23 3JL",
  "drive_from_monmouth_mins": 135
}
