{
  "id": 144,
  "slug": "kidwelly-castle-quay-salt-marsh",
  "name": "Kidwelly Castle, Quay & Salt Marsh",
  "region": "Carmarthenshire & West Wales",
  "sub_area": "Carmarthen Bay",
  "nearest_town": "Kidwelly",
  "distance_mi": 4.5,
  "elevation_gain_m": 40,
  "est_time_hrs": 2.0,
  "difficulty": "Easy",
  "route_type": "Loop",
  "terrain": "Lanes, riverside, salt-marsh boardwalk",
  "dogs_allowed": "Yes",
  "dog_lead_policy": "On lead (livestock, nesting birds)",
  "pushchair_friendly": "Partial",
  "waymarked": "Partial",
  "best_season": "All year",
  "highlights": "One of Wales's most complete Norman castles plus a quiet tidal estuary full of waders.",
  "points_of_interest": "Kidwelly Castle (Cadw, 1106); Kidwelly Industrial Museum; quay ruins",
  "viewpoints": "Castle ramparts; salt-marsh panorama",
  "water_features": "Afon Gwendraeth tidal reaches",
  "picnic_spots": "Castle lawn (Cadw members only) or quay",
  "parking_start": "Kidwelly Castle car park (free)",
  "food_drink_nearby": "The Boot & Shoe Kidwelly; Penny Chandler Ferryside (nearby)",
  "toilets": "Castle (seasonal)",
  "public_transport": "Kidwelly rail station",
  "hazards_notes": "Salt marsh floods at spring tides; castle entry fee",
  "start_postcode": "SA17 5BQ",
  "drive_from_monmouth_mins": 110
}
