{
  "id": 80,
  "slug": "afan-forest-penhydd-pen-pych",
  "name": "Afan Forest: Penhydd / Pen Pych",
  "region": "Valleys & Vale of Glamorgan",
  "sub_area": "Afan Valley",
  "nearest_town": "Port Talbot",
  "distance_mi": 5.0,
  "elevation_gain_m": 300,
  "est_time_hrs": 2.75,
  "difficulty": "Moderate",
  "route_type": "Loop",
  "terrain": "Forestry road, boardwalks, waterfalls",
  "dogs_allowed": "Yes",
  "dog_lead_policy": "On lead where signed (bikes)",
  "pushchair_friendly": "Partial",
  "waymarked": "Yes",
  "best_season": "All year",
  "highlights": "Flat-top mountain with multi-stream waterfall cascade.",
  "points_of_interest": "Blaenrhondda waterfalls; mining heritage",
  "viewpoints": "Afan Valley; Rhondda Fawr",
  "water_features": "Waterfalls on Afon Rhondda",
  "picnic_spots": "Near waterfalls",
  "parking_start": "Blaencwm car park (Rhondda)",
  "food_drink_nearby": "Treherbert pubs; Afan Lodge cafe",
  "toilets": "Afan Forest Visitor Centre",
  "public_transport": "Bus/train to Treherbert",
  "hazards_notes": "Mountain bike trails — watch out",
  "start_postcode": "CF42 5RR",
  "drive_from_monmouth_mins": 90
}
