{
  "id": 75,
  "slug": "nash-point-to-monknash",
  "name": "Nash Point to Monknash",
  "region": "Valleys & Vale of Glamorgan",
  "sub_area": "Glamorgan Heritage Coast",
  "nearest_town": "Marcross",
  "distance_mi": 5.0,
  "elevation_gain_m": 180,
  "est_time_hrs": 2.75,
  "difficulty": "Moderate",
  "route_type": "Linear (return)",
  "terrain": "Cliff top, beach, valley",
  "dogs_allowed": "Yes",
  "dog_lead_policy": "On lead (cliffs, livestock)",
  "pushchair_friendly": "No",
  "waymarked": "Yes",
  "best_season": "All year",
  "highlights": "Lighthouse, wave-cut platforms and the hidden Cwm Marcross.",
  "points_of_interest": "Nash Point Lighthouse (active fog signal); Monknash monastic grange",
  "viewpoints": "Bristol Channel; Exmoor",
  "water_features": "Sea; waterfall at Traeth Bach",
  "picnic_spots": "Cwm Marcross",
  "parking_start": "Nash Point car park (pay)",
  "food_drink_nearby": "Plough & Harrow Monknash (award-winning pub)",
  "toilets": "Nash Point",
  "public_transport": "None",
  "hazards_notes": "Cliff falls; mud in valley",
  "start_postcode": "CF61 1ZH",
  "drive_from_monmouth_mins": 80
}
