{
  "id": 3,
  "slug": "cwm-llwch-tommy-jones-obelisk",
  "name": "Cwm Llwch & Tommy Jones Obelisk",
  "region": "Brecon Beacons / Bannau Brycheiniog",
  "sub_area": "Central Beacons",
  "nearest_town": "Brecon",
  "distance_mi": 7.0,
  "elevation_gain_m": 600,
  "est_time_hrs": 4.0,
  "difficulty": "Moderate",
  "route_type": "Out-and-back",
  "terrain": "Valley track, steep grass ridge",
  "dogs_allowed": "Yes",
  "dog_lead_policy": "On lead (livestock)",
  "pushchair_friendly": "No",
  "waymarked": "No",
  "best_season": "April–October",
  "highlights": "Quieter route to Pen y Fan via Llyn Cwm Llwch tarn and poignant memorial.",
  "points_of_interest": "Tommy Jones obelisk (boy who died 1900)",
  "viewpoints": "Glacial cwm views; Corn Du cliffs from below",
  "water_features": "Llyn Cwm Llwch (glacial tarn)",
  "picnic_spots": "Flat grass by Llyn Cwm Llwch",
  "parking_start": "Cwm Llwch car park (limited spaces)",
  "food_drink_nearby": "The Bull's Head Brecon; Felin Fach Griffin",
  "toilets": "None",
  "public_transport": "None (drive required)",
  "hazards_notes": "Path rough in places; remote feel",
  "start_postcode": "LD3 8RP",
  "drive_from_monmouth_mins": 60
}
