{
  "id": 48,
  "slug": "tenby-to-penally-via-south-beach",
  "name": "Tenby to Penally via South Beach",
  "region": "Pembrokeshire (South)",
  "sub_area": "Tenby coast",
  "nearest_town": "Tenby",
  "distance_mi": 4.5,
  "elevation_gain_m": 60,
  "est_time_hrs": 2.0,
  "difficulty": "Easy",
  "route_type": "Linear (train back)",
  "terrain": "Beach, clifftop",
  "dogs_allowed": "Yes",
  "dog_lead_policy": "On lead May–Sep on beach (restrictions)",
  "pushchair_friendly": "Partial",
  "waymarked": "Yes (Wales Coast Path)",
  "best_season": "All year",
  "highlights": "Gorgeous sweep of South Beach with Caldey Island views.",
  "points_of_interest": "Tenby town walls; St Catherine's Island fort",
  "viewpoints": "Caldey Island; Giltar Point",
  "water_features": "Sea",
  "picnic_spots": "South Beach; Giltar Point grass",
  "parking_start": "Tenby multi-storey or South Beach",
  "food_drink_nearby": "Plantagenet House; D Fecci Fish & Chips; Tenby Harbour",
  "toilets": "Tenby, South Beach",
  "public_transport": "Train Penally–Tenby",
  "hazards_notes": "MoD firing range at Giltar — flags mean closed",
  "start_postcode": "SA70 7BN",
  "drive_from_monmouth_mins": 145
}
