{
  "id": 18,
  "slug": "craig-cerrig-gleisiad-nnr",
  "name": "Craig Cerrig-gleisiad NNR",
  "region": "Brecon Beacons / Bannau Brycheiniog",
  "sub_area": "Fforest Fawr",
  "nearest_town": "Libanus",
  "distance_mi": 3.5,
  "elevation_gain_m": 270,
  "est_time_hrs": 2.5,
  "difficulty": "Moderate",
  "route_type": "Loop",
  "terrain": "Boggy grass, rocky cwm, steep ground",
  "dogs_allowed": "Yes",
  "dog_lead_policy": "On lead (NNR rules, birds)",
  "pushchair_friendly": "No",
  "waymarked": "No",
  "best_season": "May–Sept",
  "highlights": "Spectacular glacial cwm with rare arctic-alpine flora and ravens.",
  "points_of_interest": "National Nature Reserve (SSSI)",
  "viewpoints": "Dramatic crag views; Pen y Fan from ridge",
  "water_features": "Streams in cwm",
  "picnic_spots": "Above the cwm on the plateau",
  "parking_start": "Layby on A470 opposite the cwm",
  "food_drink_nearby": "Tai'r Bull Inn Libanus; Beacons Visitor Centre cafe",
  "toilets": "None",
  "public_transport": "T4 bus stops on A470",
  "hazards_notes": "Fragile habitat; stay on paths",
  "start_postcode": "LD3 8NL",
  "drive_from_monmouth_mins": 55
}
