{
  "id": 87,
  "slug": "the-kymin-round-walk",
  "name": "The Kymin Round Walk",
  "region": "Wye Valley & Monmouthshire",
  "sub_area": "Monmouth",
  "nearest_town": "Monmouth",
  "distance_mi": 3.5,
  "elevation_gain_m": 230,
  "est_time_hrs": 2.0,
  "difficulty": "Moderate",
  "route_type": "Loop",
  "terrain": "Woodland, lanes, hill summit",
  "dogs_allowed": "Yes",
  "dog_lead_policy": "On lead (roads)",
  "pushchair_friendly": "No",
  "waymarked": "Partial",
  "best_season": "All year",
  "highlights": "NT hilltop with Naval Temple and Round House above Monmouth.",
  "points_of_interest": "Naval Temple (1800); Round House Pavilion",
  "viewpoints": "Wye Valley; Herefordshire; Welsh borders",
  "water_features": "River Wye",
  "picnic_spots": "Kymin lawn (NT)",
  "parking_start": "NT Kymin car park or Monmouth town",
  "food_drink_nearby": "Punch House Monmouth; Gilpin Coffee Monmouth",
  "toilets": "Monmouth",
  "public_transport": "Bus to Monmouth",
  "hazards_notes": "Narrow roads to car park",
  "start_postcode": "NP25 3SF",
  "drive_from_monmouth_mins": 10
}
