{
  "id": 36,
  "slug": "whiteford-burrows-lighthouse",
  "name": "Whiteford Burrows & Lighthouse",
  "region": "Gower & Swansea Bay",
  "sub_area": "North Gower",
  "nearest_town": "Llanmadoc",
  "distance_mi": 6.0,
  "elevation_gain_m": 30,
  "est_time_hrs": 3.0,
  "difficulty": "Moderate",
  "route_type": "Loop",
  "terrain": "Dunes, pine forest, saltmarsh, beach",
  "dogs_allowed": "Yes",
  "dog_lead_policy": "On lead in NNR (birds, livestock)",
  "pushchair_friendly": "No",
  "waymarked": "Partial",
  "best_season": "All year",
  "highlights": "Remote north-Gower spit with a cast-iron lighthouse (unique in UK).",
  "points_of_interest": "Whiteford Lighthouse (1865, only UK cast-iron offshore)",
  "viewpoints": "Loughor Estuary; Carmarthen Bay",
  "water_features": "Estuary; sea",
  "picnic_spots": "Dunes above beach",
  "parking_start": "Cwm Ivy / Llanmadoc NT parking",
  "food_drink_nearby": "Britannia Inn Llanmadoc",
  "toilets": "Llanmadoc (limited)",
  "public_transport": "None",
  "hazards_notes": "Check tides (cut-off possible); Ministry of Defence debris on beach",
  "start_postcode": "SA3 1DD",
  "drive_from_monmouth_mins": 100
}
