{
  "id": 52,
  "slug": "angle-peninsula-circular",
  "name": "Angle Peninsula Circular",
  "region": "Pembrokeshire (South)",
  "sub_area": "Angle",
  "nearest_town": "Angle",
  "distance_mi": 7.5,
  "elevation_gain_m": 180,
  "est_time_hrs": 3.75,
  "difficulty": "Moderate",
  "route_type": "Loop",
  "terrain": "Coast path, lanes, field paths",
  "dogs_allowed": "Yes",
  "dog_lead_policy": "On lead (livestock)",
  "pushchair_friendly": "No",
  "waymarked": "Yes (Wales Coast Path)",
  "best_season": "All year",
  "highlights": "Circuit of the western tip of the Pembrokeshire peninsula.",
  "points_of_interest": "Thorn Island fort; WWII defences; Angle lifeboat station",
  "viewpoints": "Milford Haven entrance; West Angle Bay",
  "water_features": "Sea; bay",
  "picnic_spots": "West Angle Bay; East Angle Bay",
  "parking_start": "West Angle Bay car park",
  "food_drink_nearby": "Old Point House Angle (pub on causeway); Café Môr Freshwater West",
  "toilets": "West Angle Bay",
  "public_transport": "Very limited",
  "hazards_notes": "Old Point House tide-cut at high water",
  "start_postcode": "SA71 5AQ",
  "drive_from_monmouth_mins": 155
}
