{
  "id": 154,
  "slug": "black-hill-cat-s-back-ridge",
  "name": "Black Hill / Cat's Back Ridge",
  "region": "English Borders (Forest of Dean & Herefordshire)",
  "sub_area": "Herefordshire (Black Mountains)",
  "nearest_town": "Longtown",
  "distance_mi": 5.5,
  "elevation_gain_m": 380,
  "est_time_hrs": 3.0,
  "difficulty": "Moderate",
  "route_type": "Loop",
  "terrain": "Narrow ridge crest, grass, rocky crag",
  "dogs_allowed": "Yes",
  "dog_lead_policy": "On lead (cliff edges, sheep)",
  "pushchair_friendly": "No",
  "waymarked": "No",
  "best_season": "April–October",
  "highlights": "Spine-of-a-cat ridge rising straight out of Herefordshire — the English shoulder of the Black Mountains.",
  "points_of_interest": "Black Hill trig (640m); Offa's Dyke path continuation",
  "viewpoints": "Vale of Ewyas, Hay Bluff, Hatterrall ridge, Malverns eastwards",
  "water_features": "Olchon Brook in valley",
  "picnic_spots": "Grassy saddle before summit",
  "parking_start": "Olchon Valley layby at Cat's Back end",
  "food_drink_nearby": "The Crown Longtown; Olchon Court (B&B)",
  "toilets": "None",
  "public_transport": "None",
  "hazards_notes": "Narrow rocky ridge — not for vertigo sufferers",
  "start_postcode": "HR2 0NP",
  "drive_from_monmouth_mins": 50
}
