{
  "id": 167,
  "slug": "lavernock-point-cliff-walk",
  "name": "Lavernock Point & Cliff Walk",
  "region": "Valleys & Vale of Glamorgan",
  "sub_area": "Vale of Glamorgan",
  "nearest_town": "Lavernock",
  "distance_mi": 3.0,
  "elevation_gain_m": 80,
  "est_time_hrs": 1.5,
  "difficulty": "Easy",
  "route_type": "Out-and-back",
  "terrain": "Cliff path, steps, short road section",
  "dogs_allowed": "Yes",
  "dog_lead_policy": "On lead (cliff edges)",
  "pushchair_friendly": "No",
  "waymarked": "Yes (Wales Coast Path)",
  "best_season": "All year",
  "highlights": "Marconi's first over-sea radio transmission site plus Jurassic cliffs and autumn bird passage.",
  "points_of_interest": "Marconi plaque (1897 transmission); Glamorgan Heritage Coast fossils; Sully Island ferry option",
  "viewpoints": "Penarth headland; Steepholm & Flatholm islands",
  "water_features": "Bristol Channel",
  "picnic_spots": "Cliff-top grass above Lavernock beach",
  "parking_start": "Lavernock Point road-end (free, limited)",
  "food_drink_nearby": "The Captain's Wife Sully; The Pilot Penarth",
  "toilets": "None",
  "public_transport": "Bus from Penarth/Barry",
  "hazards_notes": "Cliffs crumble; Sully causeway tide-dependent",
  "start_postcode": "CF64 5UT",
  "drive_from_monmouth_mins": 55
}
