{
  "id": 138,
  "slug": "dinefwr-park-castle-nt",
  "name": "Dinefwr Park & Castle (NT)",
  "region": "Carmarthenshire & West Wales",
  "sub_area": "Tywi Valley",
  "nearest_town": "Llandeilo",
  "distance_mi": 4.0,
  "elevation_gain_m": 90,
  "est_time_hrs": 1.75,
  "difficulty": "Easy",
  "route_type": "Loop",
  "terrain": "Parkland tracks, boardwalk, some steps to castle",
  "dogs_allowed": "Yes (restricted zones)",
  "dog_lead_policy": "On lead in castle precinct, off-lead on main loop",
  "pushchair_friendly": "Partial (main loop)",
  "waymarked": "Yes",
  "best_season": "All year",
  "highlights": "Medieval castle above meandering Tywi — white cattle, fallow deer and bog boardwalks.",
  "points_of_interest": "Dinefwr Castle (Cadw/NT); Newton House; White Park cattle; fallow deer herd",
  "viewpoints": "Castle ramparts with Tywi meander view; Black Mountain on horizon",
  "water_features": "Afon Tywi oxbow; mill pond",
  "picnic_spots": "Castle lawn or parkland picnic area",
  "parking_start": "NT Newton House car park (NT members free)",
  "food_drink_nearby": "The Angel Hotel Llandeilo; The Salty Dog; Y Capel Bach Bistro",
  "toilets": "NT Newton House",
  "public_transport": "Llandeilo rail station, 1 mi walk",
  "hazards_notes": "NT entry required for park; cattle best kept wide of",
  "start_postcode": "SA19 6RT",
  "drive_from_monmouth_mins": 90
}
